{
  "$schema": "https://json-schema.org/draft/2020-12/schema",
  "title": "RootConfig",
  "type": "object",
  "properties": {
    "$schema": {
      "type": [
        "string",
        "null"
      ]
    },
    "analytics": {
      "$ref": "#/$defs/AnalyticsConfig",
      "default": {
        "catalog": {},
        "http": {
          "ingest_endpoint_enabled": true
        },
        "ingest": {
          "processor_enabled": true
        },
        "job_store": {
          "request_timeout_ms": 5000
        },
        "object_storage": {
          "provider": "s3",
          "scheme": "s3"
        },
        "operations": {},
        "privacy": {},
        "query": {
          "disable_query_deadline": false,
          "lambda_query_only": false,
          "lambda_response_compression": "none",
          "max_read_connections": 64
        },
        "retention": {
          "delete_batch_size": 500,
          "enabled": false,
          "sweep_interval_ms": 60000,
          "tables": []
        },
        "source": {
          "poll_interval_ms": 100,
          "poll_max_records_per_response": 8192,
          "poll_max_responses_per_interval": 4,
          "poll_max_shards": 16,
          "poll_request_timeout_ms": 5000,
          "tables": []
        }
      }
    },
    "description": {
      "type": [
        "string",
        "null"
      ]
    },
    "features": {
      "$ref": "#/$defs/Features",
      "default": {
        "metrics": {
          "enabled": true
        }
      }
    },
    "http": {
      "$ref": "#/$defs/HttpConfig",
      "default": {
        "bind_addr": "0.0.0.0:8080",
        "cors": {
          "allow_origins": [
            "*"
          ]
        }
      }
    },
    "tracing": {
      "$ref": "#/$defs/Tracing",
      "default": {
        "log_level": "warn"
      }
    },
    "version": {
      "type": "string",
      "default": "1"
    }
  },
  "additionalProperties": false,
  "$defs": {
    "AnalyticsCatalogBackend": {
      "type": "string",
      "enum": [
        "duckdb",
        "ducklake_sqlite",
        "ducklake_aux_catalog",
        "ducklake_motherduck"
      ]
    },
    "AnalyticsCatalogConfig": {
      "type": "object",
      "properties": {
        "backend": {
          "anyOf": [
            {
              "$ref": "#/$defs/AnalyticsCatalogBackend"
            },
            {
              "type": "null"
            }
          ]
        },
        "connection_string": {
          "type": [
            "string",
            "null"
          ]
        },
        "duckdb_threads": {
          "type": [
            "integer",
            "null"
          ],
          "format": "uint",
          "minimum": 0
        },
        "motherduck_token": {
          "type": [
            "string",
            "null"
          ]
        }
      },
      "additionalProperties": false
    },
    "AnalyticsConfig": {
      "type": "object",
      "properties": {
        "catalog": {
          "$ref": "#/$defs/AnalyticsCatalogConfig",
          "default": {}
        },
        "http": {
          "$ref": "#/$defs/AnalyticsHttpConfig",
          "default": {
            "ingest_endpoint_enabled": true
          }
        },
        "ingest": {
          "$ref": "#/$defs/AnalyticsIngestConfig",
          "default": {
            "processor_enabled": true
          }
        },
        "job_store": {
          "$ref": "#/$defs/AnalyticsJobStoreConfig",
          "default": {
            "request_timeout_ms": 5000
          }
        },
        "manifest_path": {
          "type": [
            "string",
            "null"
          ]
        },
        "object_storage": {
          "$ref": "#/$defs/AnalyticsObjectStorageConfig",
          "default": {
            "provider": "s3",
            "scheme": "s3"
          }
        },
        "operations": {
          "$ref": "#/$defs/AnalyticsOperationsConfig",
          "default": {}
        },
        "privacy": {
          "$ref": "#/$defs/AnalyticsPrivacyConfig",
          "default": {}
        },
        "query": {
          "$ref": "#/$defs/AnalyticsQueryConfig",
          "default": {
            "disable_query_deadline": false,
            "lambda_query_only": false,
            "lambda_response_compression": "none",
            "max_read_connections": 64
          }
        },
        "retention": {
          "$ref": "#/$defs/AnalyticsRetentionConfig",
          "default": {
            "delete_batch_size": 500,
            "enabled": false,
            "sweep_interval_ms": 60000,
            "tables": []
          }
        },
        "source": {
          "$ref": "#/$defs/AnalyticsSourceConfig",
          "default": {
            "poll_interval_ms": 100,
            "poll_max_records_per_response": 8192,
            "poll_max_responses_per_interval": 4,
            "poll_max_shards": 16,
            "poll_request_timeout_ms": 5000,
            "tables": []
          }
        }
      },
      "additionalProperties": false
    },
    "AnalyticsHttpConfig": {
      "type": "object",
      "properties": {
        "ingest_endpoint_enabled": {
          "type": "boolean",
          "default": true
        }
      },
      "additionalProperties": false
    },
    "AnalyticsIngestConfig": {
      "type": "object",
      "properties": {
        "processor_enabled": {
          "type": "boolean",
          "default": true
        }
      },
      "additionalProperties": false
    },
    "AnalyticsJobStoreConfig": {
      "type": "object",
      "properties": {
        "endpoint_url": {
          "description": "Unauthenticated HTTP-only endpoint for the scheduled JobStore.",
          "type": [
            "string",
            "null"
          ]
        },
        "request_timeout_ms": {
          "type": "integer",
          "format": "uint64",
          "default": 5000,
          "minimum": 0
        }
      },
      "additionalProperties": false
    },
    "AnalyticsLambdaResponseCompression": {
      "type": "string",
      "enum": [
        "none",
        "gzip_base64"
      ]
    },
    "AnalyticsObjectStorageConfig": {
      "type": "object",
      "properties": {
        "bucket": {
          "type": [
            "string",
            "null"
          ]
        },
        "credentials": {
          "anyOf": [
            {
              "$ref": "#/$defs/RemoteCredentialsConfig"
            },
            {
              "type": "null"
            }
          ]
        },
        "endpoint_url": {
          "type": [
            "string",
            "null"
          ]
        },
        "path": {
          "type": [
            "string",
            "null"
          ]
        },
        "provider": {
          "$ref": "#/$defs/AnalyticsObjectStorageProvider",
          "default": "s3"
        },
        "region": {
          "type": [
            "string",
            "null"
          ]
        },
        "scheme": {
          "type": "string",
          "default": "s3"
        }
      },
      "additionalProperties": false
    },
    "AnalyticsObjectStorageProvider": {
      "type": "string",
      "enum": [
        "s3",
        "r2",
        "generic"
      ]
    },
    "AnalyticsOperationsConfig": {
      "type": "object",
      "properties": {
        "operation_store_path": {
          "description": "DuckDB path used for durable maintenance operation state.",
          "type": [
            "string",
            "null"
          ]
        }
      },
      "additionalProperties": false
    },
    "AnalyticsPrivacyConfig": {
      "type": "object",
      "properties": {
        "policy_path": {
          "type": [
            "string",
            "null"
          ]
        }
      },
      "additionalProperties": false
    },
    "AnalyticsQueryConfig": {
      "type": "object",
      "properties": {
        "disable_query_deadline": {
          "description": "Disable the Lambda tenant-query deadline; explicit cancellation remains\nactive.",
          "type": "boolean",
          "default": false
        },
        "lambda_query_only": {
          "type": "boolean",
          "default": false
        },
        "lambda_response_compression": {
          "$ref": "#/$defs/AnalyticsLambdaResponseCompression",
          "default": "none"
        },
        "max_read_connections": {
          "type": "integer",
          "format": "uint",
          "default": 64,
          "minimum": 0
        },
        "max_response_size_kb": {
          "type": [
            "integer",
            "null"
          ],
          "format": "uint",
          "minimum": 0
        }
      },
      "additionalProperties": false
    },
    "AnalyticsRetentionConfig": {
      "type": "object",
      "properties": {
        "delete_batch_size": {
          "type": "integer",
          "format": "uint64",
          "default": 500,
          "minimum": 0
        },
        "enabled": {
          "type": "boolean",
          "default": false
        },
        "sweep_interval_ms": {
          "type": "integer",
          "format": "uint64",
          "default": 60000,
          "minimum": 0
        },
        "tables": {
          "type": "array",
          "default": [],
          "items": {
            "$ref": "#/$defs/AnalyticsRetentionTableConfig"
          }
        }
      },
      "additionalProperties": false
    },
    "AnalyticsRetentionTableConfig": {
      "type": "object",
      "properties": {
        "analytics_table_name": {
          "type": "string"
        },
        "default_period_ms": {
          "type": "integer",
          "format": "uint64",
          "minimum": 0
        },
        "strict": {
          "type": "boolean",
          "default": false
        },
        "tenant_policy": {
          "$ref": "#/$defs/TenantRetentionPolicyConfig"
        },
        "timestamp": {
          "$ref": "#/$defs/RetentionTimestampConfig"
        }
      },
      "additionalProperties": false,
      "required": [
        "analytics_table_name",
        "default_period_ms",
        "timestamp",
        "tenant_policy"
      ]
    },
    "AnalyticsSourceConfig": {
      "type": "object",
      "properties": {
        "credentials": {
          "anyOf": [
            {
              "$ref": "#/$defs/RemoteCredentialsConfig"
            },
            {
              "type": "null"
            }
          ]
        },
        "endpoint_url": {
          "description": "Stream transport endpoint override.",
          "type": [
            "string",
            "null"
          ]
        },
        "poll_interval_ms": {
          "type": "integer",
          "format": "uint64",
          "default": 100,
          "minimum": 0
        },
        "poll_max_records_per_response": {
          "type": "integer",
          "format": "uint32",
          "default": 8192,
          "minimum": 0
        },
        "poll_max_responses_per_interval": {
          "type": "integer",
          "format": "uint",
          "default": 4,
          "minimum": 0
        },
        "poll_max_shards": {
          "type": "integer",
          "format": "uint",
          "default": 16,
          "minimum": 0
        },
        "poll_request_timeout_ms": {
          "type": "integer",
          "format": "uint64",
          "default": 5000,
          "minimum": 0
        },
        "region": {
          "type": [
            "string",
            "null"
          ]
        },
        "stream_type": {
          "anyOf": [
            {
              "$ref": "#/$defs/AnalyticsStreamType"
            },
            {
              "type": "null"
            }
          ]
        },
        "tables": {
          "type": "array",
          "default": [],
          "items": {
            "$ref": "#/$defs/AnalyticsSourceTableConfig"
          }
        }
      },
      "additionalProperties": false
    },
    "AnalyticsSourceTableConfig": {
      "type": "object",
      "properties": {
        "stream_identifier": {
          "type": [
            "string",
            "null"
          ]
        },
        "stream_type": {
          "anyOf": [
            {
              "$ref": "#/$defs/AnalyticsStreamType"
            },
            {
              "type": "null"
            }
          ]
        },
        "table_name": {
          "type": "string"
        }
      },
      "additionalProperties": false,
      "required": [
        "table_name"
      ]
    },
    "AnalyticsStreamType": {
      "type": "string",
      "enum": [
        "storage_stream",
        "aux_storage"
      ]
    },
    "Cors": {
      "type": "object",
      "properties": {
        "allow_origins": {
          "type": "array",
          "default": [],
          "items": {
            "type": "string"
          }
        }
      },
      "additionalProperties": false
    },
    "Features": {
      "type": "object",
      "properties": {
        "metrics": {
          "$ref": "#/$defs/MetricsConfig",
          "default": {
            "enabled": true
          }
        }
      },
      "additionalProperties": false
    },
    "HttpConfig": {
      "type": "object",
      "properties": {
        "bind_addr": {
          "type": "string",
          "default": "0.0.0.0:8080"
        },
        "cors": {
          "$ref": "#/$defs/Cors",
          "default": {
            "allow_origins": [
              "*"
            ]
          }
        }
      },
      "additionalProperties": false
    },
    "MetricsConfig": {
      "type": "object",
      "properties": {
        "enabled": {
          "type": "boolean",
          "default": true
        }
      },
      "additionalProperties": false
    },
    "RemoteCredentialsConfig": {
      "type": "object",
      "properties": {
        "instance_keys": {
          "type": [
            "boolean",
            "null"
          ]
        },
        "static": {
          "anyOf": [
            {
              "$ref": "#/$defs/RemoteStaticCredentialsConfig"
            },
            {
              "type": "null"
            }
          ]
        }
      },
      "additionalProperties": false
    },
    "RemoteStaticCredentialsConfig": {
      "type": "object",
      "properties": {
        "access_key": {
          "type": "string"
        },
        "secret_key": {
          "type": "string"
        },
        "session_token": {
          "type": [
            "string",
            "null"
          ]
        }
      },
      "additionalProperties": false,
      "required": [
        "access_key",
        "secret_key"
      ]
    },
    "RetentionDurationSelector": {
      "type": "object",
      "properties": {
        "attribute_path": {
          "type": "string"
        }
      },
      "additionalProperties": false,
      "required": [
        "attribute_path"
      ]
    },
    "RetentionTimestampConfig": {
      "oneOf": [
        {
          "type": "object",
          "properties": {
            "attribute_path": {
              "type": "string"
            },
            "kind": {
              "type": "string",
              "const": "attribute"
            }
          },
          "required": [
            "kind",
            "attribute_path"
          ]
        },
        {
          "type": "object",
          "properties": {
            "kind": {
              "type": "string",
              "const": "ingested_at"
            }
          },
          "required": [
            "kind"
          ]
        }
      ]
    },
    "TenantRetentionGetItemRequest": {
      "type": "object",
      "properties": {
        "consistent_read": {
          "type": [
            "boolean",
            "null"
          ]
        },
        "expression_attribute_names": {
          "type": [
            "object",
            "null"
          ],
          "additionalProperties": {
            "type": "string"
          }
        },
        "key": {
          "type": "object",
          "additionalProperties": true
        },
        "projection_expression": {
          "type": [
            "string",
            "null"
          ]
        },
        "table_name": {
          "type": "string"
        }
      },
      "additionalProperties": false,
      "required": [
        "table_name",
        "key"
      ]
    },
    "TenantRetentionPolicyConfig": {
      "type": "object",
      "properties": {
        "cache_ttl_ms": {
          "type": "integer",
          "format": "uint64",
          "default": 300000,
          "minimum": 0
        },
        "credentials": {
          "anyOf": [
            {
              "$ref": "#/$defs/RemoteCredentialsConfig"
            },
            {
              "type": "null"
            }
          ]
        },
        "duration_selector": {
          "$ref": "#/$defs/RetentionDurationSelector"
        },
        "endpoint_url": {
          "type": [
            "string",
            "null"
          ]
        },
        "region": {
          "type": [
            "string",
            "null"
          ]
        },
        "request": {
          "$ref": "#/$defs/TenantRetentionPolicyRequest"
        },
        "source": {
          "$ref": "#/$defs/TenantRetentionPolicySource"
        }
      },
      "additionalProperties": false,
      "required": [
        "source",
        "request",
        "duration_selector"
      ]
    },
    "TenantRetentionPolicyRequest": {
      "oneOf": [
        {
          "type": "object",
          "properties": {
            "get_item": {
              "$ref": "#/$defs/TenantRetentionGetItemRequest"
            }
          },
          "additionalProperties": false,
          "required": [
            "get_item"
          ]
        },
        {
          "type": "object",
          "properties": {
            "query_table": {
              "$ref": "#/$defs/TenantRetentionQueryTableRequest"
            }
          },
          "additionalProperties": false,
          "required": [
            "query_table"
          ]
        }
      ]
    },
    "TenantRetentionPolicySource": {
      "type": "string",
      "enum": [
        "aux_storage",
        "dynamodb"
      ]
    },
    "TenantRetentionQueryTableRequest": {
      "type": "object",
      "properties": {
        "expression_attribute_names": {
          "type": [
            "object",
            "null"
          ],
          "additionalProperties": {
            "type": "string"
          }
        },
        "expression_attribute_values": {
          "type": "object",
          "additionalProperties": true
        },
        "filter_expression": {
          "type": [
            "string",
            "null"
          ]
        },
        "index_name": {
          "type": [
            "string",
            "null"
          ]
        },
        "key_condition_expression": {
          "type": "string"
        },
        "limit": {
          "type": "integer",
          "format": "uint32",
          "minimum": 0
        },
        "scan_index_forward": {
          "type": [
            "boolean",
            "null"
          ]
        },
        "table_name": {
          "type": "string"
        }
      },
      "additionalProperties": false,
      "required": [
        "table_name",
        "key_condition_expression",
        "expression_attribute_values",
        "limit"
      ]
    },
    "Tracing": {
      "type": "object",
      "properties": {
        "log_level": {
          "type": [
            "string",
            "null"
          ],
          "default": "warn"
        }
      },
      "additionalProperties": false
    }
  }
}
